{"schema":"asb.books/2","canon":"protestant-66","versification":"BSB (31,102 verses); OpenBible refs outside it are clamped to the chapter's last verse (3 John 1:15 -> 1:14)","books":[{"bookNo":1,"osis":"Gen","name":"Genesis","short":"Gen","sourceName":"Genesis","aliases":["Gen","Gn"],"testament":"OT","chapters":50,"verses":1533,"firstVid":1001001,"firstOrdinal":0,"verseCounts":[31,25,24,26,32,22,24,22,29,32,32,20,18,24,21,16,27,33,38,18,34,24,20,67,34,35,46,22,35,43,55,32,20,31,29,43,36,30,23,23,57,38,34,34,28,34,31,22,33,26]},{"bookNo":2,"osis":"Exod","name":"Exodus","short":"Exod","sourceName":"Exodus","aliases":["Exod","Ex","Exo"],"testament":"OT","chapters":40,"verses":1213,"firstVid":2001001,"firstOrdinal":1533,"verseCounts":[22,25,22,31,23,30,25,32,35,29,10,51,22,31,27,36,16,27,25,26,36,31,33,18,40,37,21,43,46,38,18,35,23,35,35,38,29,31,43,38]},{"bookNo":3,"osis":"Lev","name":"Leviticus","short":"Lev","sourceName":"Leviticus","aliases":["Lev","Lv"],"testament":"OT","chapters":27,"verses":859,"firstVid":3001001,"firstOrdinal":2746,"verseCounts":[17,16,17,35,19,30,38,36,24,20,47,8,59,57,33,34,16,30,37,27,24,33,44,23,55,46,34]},{"bookNo":4,"osis":"Num","name":"Numbers","short":"Num","sourceName":"Numbers","aliases":["Num","Nm"],"testament":"OT","chapters":36,"verses":1288,"firstVid":4001001,"firstOrdinal":3605,"verseCounts":[54,34,51,49,31,27,89,26,23,36,35,16,33,45,41,50,13,32,22,29,35,41,30,25,18,65,23,31,40,16,54,42,56,29,34,13]},{"bookNo":5,"osis":"Deut","name":"Deuteronomy","short":"Deut","sourceName":"Deuteronomy","aliases":["Deut","Dt"],"testament":"OT","chapters":34,"verses":959,"firstVid":5001001,"firstOrdinal":4893,"verseCounts":[46,37,29,49,33,25,26,20,29,22,32,32,18,29,23,22,20,22,21,20,23,30,25,22,19,19,26,68,29,20,30,52,29,12]},{"bookNo":6,"osis":"Josh","name":"Joshua","short":"Josh","sourceName":"Joshua","aliases":["Josh","Jos"],"testament":"OT","chapters":24,"verses":658,"firstVid":6001001,"firstOrdinal":5852,"verseCounts":[18,24,17,24,15,27,26,35,27,43,23,24,33,15,63,10,18,28,51,9,45,34,16,33]},{"bookNo":7,"osis":"Judg","name":"Judges","short":"Judg","sourceName":"Judges","aliases":["Judg","Jdg","Jdgs"],"testament":"OT","chapters":21,"verses":618,"firstVid":7001001,"firstOrdinal":6510,"verseCounts":[36,23,31,24,31,40,25,35,57,18,40,15,25,20,20,31,13,31,30,48,25]},{"bookNo":8,"osis":"Ruth","name":"Ruth","short":"Ruth","sourceName":"Ruth","aliases":[],"testament":"OT","chapters":4,"verses":85,"firstVid":8001001,"firstOrdinal":7128,"verseCounts":[22,23,18,22]},{"bookNo":9,"osis":"1Sam","name":"1 Samuel","short":"1 Sam","sourceName":"I Samuel","aliases":["I Samuel","1Sam","1 Sam"],"testament":"OT","chapters":31,"verses":810,"firstVid":9001001,"firstOrdinal":7213,"verseCounts":[28,36,21,22,12,21,17,22,27,27,15,25,23,52,35,23,58,30,24,42,15,23,29,22,44,25,12,25,11,31,13]},{"bookNo":10,"osis":"2Sam","name":"2 Samuel","short":"2 Sam","sourceName":"II Samuel","aliases":["II Samuel","2Sam","2 Sam"],"testament":"OT","chapters":24,"verses":695,"firstVid":10001001,"firstOrdinal":8023,"verseCounts":[27,32,39,12,25,23,29,18,13,19,27,31,39,33,37,23,29,33,43,26,22,51,39,25]},{"bookNo":11,"osis":"1Kgs","name":"1 Kings","short":"1 Kgs","sourceName":"I Kings","aliases":["I Kings","1Kgs","1 Kgs"],"testament":"OT","chapters":22,"verses":816,"firstVid":11001001,"firstOrdinal":8718,"verseCounts":[53,46,28,34,18,38,51,66,28,29,43,33,34,31,34,34,24,46,21,43,29,53]},{"bookNo":12,"osis":"2Kgs","name":"2 Kings","short":"2 Kgs","sourceName":"II Kings","aliases":["II Kings","2Kgs","2 Kgs"],"testament":"OT","chapters":25,"verses":719,"firstVid":12001001,"firstOrdinal":9534,"verseCounts":[18,25,27,44,27,33,20,29,37,36,21,21,25,29,38,20,41,37,37,21,26,20,37,20,30]},{"bookNo":13,"osis":"1Chr","name":"1 Chronicles","short":"1 Chr","sourceName":"I Chronicles","aliases":["I Chronicles","1Chr","1 Chr"],"testament":"OT","chapters":29,"verses":942,"firstVid":13001001,"firstOrdinal":10253,"verseCounts":[54,55,24,43,26,81,40,40,44,14,47,40,14,17,29,43,27,17,19,8,30,19,32,31,31,32,34,21,30]},{"bookNo":14,"osis":"2Chr","name":"2 Chronicles","short":"2 Chr","sourceName":"II Chronicles","aliases":["II Chronicles","2Chr","2 Chr"],"testament":"OT","chapters":36,"verses":822,"firstVid":14001001,"firstOrdinal":11195,"verseCounts":[17,18,17,22,14,42,22,18,31,19,23,16,22,15,19,14,19,34,11,37,20,12,21,27,28,23,9,27,36,27,21,33,25,33,27,23]},{"bookNo":15,"osis":"Ezra","name":"Ezra","short":"Ezra","sourceName":"Ezra","aliases":[],"testament":"OT","chapters":10,"verses":280,"firstVid":15001001,"firstOrdinal":12017,"verseCounts":[11,70,13,24,17,22,28,36,15,44]},{"bookNo":16,"osis":"Neh","name":"Nehemiah","short":"Neh","sourceName":"Nehemiah","aliases":["Neh"],"testament":"OT","chapters":13,"verses":406,"firstVid":16001001,"firstOrdinal":12297,"verseCounts":[11,20,32,23,19,19,73,18,38,39,36,47,31]},{"bookNo":17,"osis":"Esth","name":"Esther","short":"Esth","sourceName":"Esther","aliases":["Esth"],"testament":"OT","chapters":10,"verses":167,"firstVid":17001001,"firstOrdinal":12703,"verseCounts":[22,23,15,17,14,14,10,17,32,3]},{"bookNo":18,"osis":"Job","name":"Job","short":"Job","sourceName":"Job","aliases":[],"testament":"OT","chapters":42,"verses":1070,"firstVid":18001001,"firstOrdinal":12870,"verseCounts":[22,13,26,21,27,30,21,22,35,22,20,25,28,22,35,22,16,21,29,29,34,30,17,25,6,14,23,28,25,31,40,22,33,37,16,33,24,41,30,24,34,17]},{"bookNo":19,"osis":"Ps","name":"Psalm","short":"Ps","sourceName":"Psalms","aliases":["Psalms","Ps","Psa","Pss"],"testament":"OT","chapters":150,"verses":2461,"firstVid":19001001,"firstOrdinal":13940,"verseCounts":[6,12,8,8,12,10,17,9,20,18,7,8,6,7,5,11,15,50,14,9,13,31,6,10,22,12,14,9,11,12,24,11,22,22,28,12,40,22,13,17,13,11,5,26,17,11,9,14,20,23,19,9,6,7,23,13,11,11,17,12,8,12,11,10,13,20,7,35,36,5,24,20,28,23,10,12,20,72,13,19,16,8,18,12,13,17,7,18,52,17,16,15,5,23,11,13,12,9,9,5,8,28,22,35,45,48,43,13,31,7,10,10,9,8,18,19,2,29,176,7,8,9,4,8,5,6,5,6,8,8,3,18,3,3,21,26,9,8,24,13,10,7,12,15,21,10,20,14,9,6]},{"bookNo":20,"osis":"Prov","name":"Proverbs","short":"Prov","sourceName":"Proverbs","aliases":["Prov","Pr","Prv"],"testament":"OT","chapters":31,"verses":915,"firstVid":20001001,"firstOrdinal":16401,"verseCounts":[33,22,35,27,23,35,27,36,18,32,31,28,25,35,33,33,28,24,29,30,31,29,35,34,28,28,27,28,27,33,31]},{"bookNo":21,"osis":"Eccl","name":"Ecclesiastes","short":"Eccl","sourceName":"Ecclesiastes","aliases":["Eccl","Ecc","Qoheleth"],"testament":"OT","chapters":12,"verses":222,"firstVid":21001001,"firstOrdinal":17316,"verseCounts":[18,26,22,16,20,12,29,17,18,20,10,14]},{"bookNo":22,"osis":"Song","name":"Song of Songs","short":"Song","sourceName":"Song of Solomon","aliases":["Song of Solomon","Song","Canticles","SOS"],"testament":"OT","chapters":8,"verses":117,"firstVid":22001001,"firstOrdinal":17538,"verseCounts":[17,17,11,16,16,13,13,14]},{"bookNo":23,"osis":"Isa","name":"Isaiah","short":"Isa","sourceName":"Isaiah","aliases":["Isa","Is"],"testament":"OT","chapters":66,"verses":1292,"firstVid":23001001,"firstOrdinal":17655,"verseCounts":[31,22,26,6,30,13,25,22,21,34,16,6,22,32,9,14,14,7,25,6,17,25,18,23,12,21,13,29,24,33,9,20,24,17,10,22,38,22,8,31,29,25,28,28,25,13,15,22,26,11,23,15,12,17,13,12,21,14,21,22,11,12,19,12,25,24]},{"bookNo":24,"osis":"Jer","name":"Jeremiah","short":"Jer","sourceName":"Jeremiah","aliases":["Jer","Je"],"testament":"OT","chapters":52,"verses":1364,"firstVid":24001001,"firstOrdinal":18947,"verseCounts":[19,37,25,31,31,30,34,22,26,25,23,17,27,22,21,21,27,23,15,18,14,30,40,10,38,24,22,17,32,24,40,44,26,22,19,32,21,28,18,16,18,22,13,30,5,28,7,47,39,46,64,34]},{"bookNo":25,"osis":"Lam","name":"Lamentations","short":"Lam","sourceName":"Lamentations","aliases":["Lam","La"],"testament":"OT","chapters":5,"verses":154,"firstVid":25001001,"firstOrdinal":20311,"verseCounts":[22,22,66,22,22]},{"bookNo":26,"osis":"Ezek","name":"Ezekiel","short":"Ezek","sourceName":"Ezekiel","aliases":["Ezek","Eze"],"testament":"OT","chapters":48,"verses":1273,"firstVid":26001001,"firstOrdinal":20465,"verseCounts":[28,10,27,17,17,14,27,18,11,22,25,28,23,23,8,63,24,32,14,49,32,31,49,27,17,21,36,26,21,26,18,32,33,31,15,38,28,23,29,49,26,20,27,31,25,24,23,35]},{"bookNo":27,"osis":"Dan","name":"Daniel","short":"Dan","sourceName":"Daniel","aliases":["Dan","Dn"],"testament":"OT","chapters":12,"verses":357,"firstVid":27001001,"firstOrdinal":21738,"verseCounts":[21,49,30,37,31,28,28,27,27,21,45,13]},{"bookNo":28,"osis":"Hos","name":"Hosea","short":"Hos","sourceName":"Hosea","aliases":["Hos","Ho"],"testament":"OT","chapters":14,"verses":197,"firstVid":28001001,"firstOrdinal":22095,"verseCounts":[11,23,5,19,15,11,16,14,17,15,12,14,16,9]},{"bookNo":29,"osis":"Joel","name":"Joel","short":"Joel","sourceName":"Joel","aliases":[],"testament":"OT","chapters":3,"verses":73,"firstVid":29001001,"firstOrdinal":22292,"verseCounts":[20,32,21]},{"bookNo":30,"osis":"Amos","name":"Amos","short":"Amos","sourceName":"Amos","aliases":[],"testament":"OT","chapters":9,"verses":146,"firstVid":30001001,"firstOrdinal":22365,"verseCounts":[15,16,15,13,27,14,17,14,15]},{"bookNo":31,"osis":"Obad","name":"Obadiah","short":"Obad","sourceName":"Obadiah","aliases":["Obad","Ob"],"testament":"OT","chapters":1,"verses":21,"firstVid":31001001,"firstOrdinal":22511,"verseCounts":[21]},{"bookNo":32,"osis":"Jonah","name":"Jonah","short":"Jonah","sourceName":"Jonah","aliases":["Jon","Jnh"],"testament":"OT","chapters":4,"verses":48,"firstVid":32001001,"firstOrdinal":22532,"verseCounts":[17,10,10,11]},{"bookNo":33,"osis":"Mic","name":"Micah","short":"Mic","sourceName":"Micah","aliases":["Mic","Mi"],"testament":"OT","chapters":7,"verses":105,"firstVid":33001001,"firstOrdinal":22580,"verseCounts":[16,13,12,13,15,16,20]},{"bookNo":34,"osis":"Nah","name":"Nahum","short":"Nah","sourceName":"Nahum","aliases":["Nah","Na"],"testament":"OT","chapters":3,"verses":47,"firstVid":34001001,"firstOrdinal":22685,"verseCounts":[15,13,19]},{"bookNo":35,"osis":"Hab","name":"Habakkuk","sho